set,type,movie1_id,movie1_title,movie2_id,movie2_title,winner,reasoning
hard,top_2_best,173,"Princess Bride, The (1987)",132,"Wizard of Oz, The (1939)",173,The Princess Bride is a quest with a mismatched ensemble whose relationships and growth carry the story slightly more than Oz's single-hero arc.
hard,relevance_vs_quality,168,Monty Python and the Holy Grail (1975),520,"Great Escape, The (1963)",168,"Monty Python's troupe-driven quest better matches the user's desire for group misfits bonding on a journey, despite The Great Escape's higher craft."
hard,opposite_vibes,241,"Last of the Mohicans, The (1992)",21,Muppet Treasure Island (1996),21,"For a bonds-first quest, Muppet Treasure Island's light, relationship-forward tone better serves the user's wish for warm ensemble growth."
medium,exact_vs_metaphor,495,Around the World in 80 Days (1956),97,Dances with Wolves (1990),97,"While Around the World is the literal quest, Dances with Wolves better matches the deeper theme of transformation through relationships on a journey."
medium,good_vs_median,210,Indiana Jones and the Last Crusade (1989),627,Robin Hood: Prince of Thieves (1991),210,Last Crusade balances old-school adventure and growing relationships with sharper execution than the more middling Robin Hood.
medium,history_logic,174,Raiders of the Lost Ark (1981),511,Lawrence of Arabia (1962),174,"Raiders' pulpy, relationship-light quest is more directly what the user asked for than Lawrence's expansive historical epic."
easy,perfect_vs_mismatch,510,"Magnificent Seven, The (1954)",435,Butch Cassidy and the Sundance Kid (1969),510,"The Magnificent Seven is an ensemble, mismatched team on a clear mission whose bonds drive the story, while Butch Cassidy is a buddy caper with different stakes."
easy,masterpiece_vs_flop,498,"African Queen, The (1951)",21,Muppet Treasure Island (1996),498,"The African Queen is a celebrated classic about two mismatched companions changing through a journey, while Muppet Treasure Island is lighter and less acclaimed."
easy,specific_vs_cliche,622,Swiss Family Robinson (1960),519,"Treasure of the Sierra Madre, The (1948)",622,"Swiss Family Robinson specifically centers on a long survival journey and family bonds, whereas Sierra Madre is more a cautionary tale about greed (a common trope)."
